subreddit,date,title,content,url,score
GenZ,2025-07-09 06:16:28,has anyone else seen this movie??,"i remember watching it when i was fairly young no more than 7,8? ive never seen or heard anything about it since watching it so im wondering if others around my age group have seen it too. im assuming its not too popular, considering that and the fact its uploaded to youtube: https://youtu.be/IUxe89HMBYM?si=sLgSE_aRCLpYE77H plot to my memory: so basically theres this soldier pig guy who eats beans and farts as like his power kinda, or maybe just a thing he does cause haha farts, and the niece thinks its wierd. he has to take her with him to meet some princess or something. they meet the princess who does NOT eat beans, she only uses dry them to make stuffed animals. but then the climax is she finally eats beans and farts like into the sky. literally. this movie almost feels like a fever dream because i cant place this into the timeline of my life like you usually can w memories, i cant give it any context. i dont rmb how old i was, what i was doing anything like that i literally just remember the movie. so if anybody else has seen it or knows more abt it than me that would be cool, thanks!!",https://i.redd.it/6bia7afrjsbf1.jpeg,1
GenZ,2025-07-09 04:56:07,Who else remembers this movie?,,https://i.redd.it/788zlwef5sbf1.jpeg,52
GenZ,2025-07-09 04:44:34,"What are ""brainrot"" memes that don't feel like ""brainrot"" to you?","This might sound crazy to some, BUT imo I think ""John Pork"" despite being considered kinda part of the brainrot team, it doesn't feel brain rot for me the same way as others might feel for ""skibidi, gyatt, etc"". Also, I'm not sure about this one but I heard some sources say that the word ""slay"" and ""delulu"" is considered brainrot but for me, I think these are just okay slang words. Ik some might disagree me on this lol but these are just my opinions and I don't want this to be a debate discussion haha",https://www.reddit.com/r/GenZ/comments/1lva075/what_are_brainrot_memes_that_dont_feel_like/,3
GenZ,2025-07-09 03:22:27,"Be honest, in highschool did yall use to follow your mutuals even tho u didnt know em irl on insta just to get more followers?",Cus ik majority of ppl in hs did it. So i wanna see [View Poll](https://www.reddit.com/poll/1lv8iv6),https://www.reddit.com/r/GenZ/comments/1lv8iv6/be_honest_in_highschool_did_yall_use_to_follow/,1
GenZ,2025-07-09 03:17:38,Advice Needed!,"I am 25F and I currently work at an afterschool program as a Assistant General Manager but I just got offered an interview at a medical office as a Front Desk Assistant with a typical 9-5 schedule and benefits but the pay is the same (which is fine because I have a roommate and can cover most of my necessities with my current pay). Everything is going well but then my boss at my current job just got hired somewhere else and her last day in the 25th. I am lowkey nervous because what if the owner of my current job wants to promote me? I would be salaried but there wouldn't be a big change to my work schedule (hour wise) and I would have to work as both GM and AGM since they won't find a replacement right away and this job is easy to be stuck in for a long time (it took my manager 5 years just to have weekends off and now she is leaving after 7 years). Since it's basically family owned, we current do not have benefits for both full time and part time employees. I know the medical office job isn't guaranteed but I guess I am thinking if I get both offers at the same time What would you guys do in this situation?",https://www.reddit.com/r/GenZ/comments/1lv8fhj/advice_needed/,4
GenZ,2025-07-09 03:17:34,The reason why immigrants are being frowned upon,"When you have people flooding into a country with no initiative to assimilate to the values and culture that country was built upon , the cultural climate of that country starts to change. White people arent the only ones worried about this but A lot of African Americans are coming to understand how this is impacting us as well. A lot immigrants come to place where ethnic enclaves are formed so they operate, live and work entirely inside their communities with no incentive to assimilate. Thats why you have Hispanics , Asians etc that have been here 20+ years and still dont know English. The biggest thing upsetting foundational American (those here before mass immigration) Whites (predominantly of English descent) black/African Americans (started being forced here as slaves in the 1600s) and natives (original people of this land). You go to some places like south Florida, Texas , California or New York and are being to made to feel like you dont belong in somewhere where you have historically always been. Many of the groups didnt not start having a actual presence until the 80s or 90s . These groups exhibit clannish behavior. For ex) once they are hired at a company they will hire nothing but Indians or Hispanic, they form communities that have entirely nothing but Asians or Hispanics. They will get in government and start putting policies in place that pushes you out of your community. For ex) Hispanics and California and south Florida requiring that employees speak Spanish. Wonder why the holidays arent the same as they were back in the day. Thats because country values shifts when it so many different ethnic groups here that do not share the same values. I could go on and on and on and on about how illegal immigration and multiculturalism has impacted American but if I did this post would be a whole book.",https://www.reddit.com/r/GenZ/comments/1lv8ffi/the_reason_why_immigrants_are_being_frowned_upon/,0
GenZ,2025-07-09 01:52:30,(Mainly for American gen z) how much money do you need to earn per year for you to feel successful?,I said American because I realize wealth goes farther in certain countries than others and the poll cant account for adjustments in cost of living. I came across an article that gen z needs 600k a year to feel successful. Since I doubt that most gen z are convinced that they can even reach that level of wealth I want to hear it straight from the gen z subreddit. I started the poll at 50k since that is approximately were the American average income is (its 47k usd a year last time I recall) https://www.forbes.com/sites/jackkelly/2024/12/04/gen-zs-benchmark-for-financial-success-is-a-600k-salary/ Edit: adding the original poll from empower https://www.empower.com/the-currency/money/secret-success-research [View Poll](https://www.reddit.com/poll/1lv6qcj),https://www.reddit.com/r/GenZ/comments/1lv6qcj/mainly_for_american_gen_z_how_much_money_do_you/,2
GenZ,2025-07-09 01:08:06,please choose,,https://i.redd.it/gp0t0e1n0rbf1.jpeg,727
GenZ,2025-07-09 00:43:33,Should I delete reddit?,[View Poll](https://www.reddit.com/poll/1lv5c47),https://www.reddit.com/r/GenZ/comments/1lv5c47/should_i_delete_reddit/,2
GenZ,2025-07-08 22:17:35,What's your personal 'Mount Rushmore' of artists? (your four favourites),"1) Avicii Favourite album - Stories Favourite songs - Levels, Wake Me Up, Sunset Jesus 2) Rihanna Favourite album - Loud Favourite songs - Rude Boy, Disturbia, Love the Way You Lie Pt 2 3) Lady Gaga Favourite album - The Fame Monster Favourite songs - Poker Face, Paparazzi, The Fame 4) Eminem Favourite album - Curtain Call Favourite songs - Mockingbird, Stan, Without Me I know I'm mentioning most of their most famous songs and albums, but they're well-known for good reason lol",https://www.reddit.com/gallery/1lv23gt,2
GenZ,2025-07-08 21:42:43,What do we think?,"Personally, I can relate.",https://v.redd.it/kdioba920qbf1,1104
GenZ,2025-07-08 21:35:51,What do I even title this?,,https://i.redd.it/lkydmanvypbf1.jpeg,1990
GenZ,2025-07-08 21:21:43,Do you think people should date within their price range?,"Me personally, I think people should date within their price range. If you are a guy and you aren't financially successful, then you shouldn't date a financially successful woman. I think successful women deserve successful men, and unsuccessful men deserve unsuccessful women. Men need to pick their price range and just shut the fuck up. No, I'm not trolling; I think certain people deserve certain things. If a guy is ugly, he doesn't deserve a beautiful woman. Think about it like this: who are the only people mad at ""gold diggers""? It's only poor men who are mad because they are too broke to get a nice girlfriend/wife.",https://www.reddit.com/r/GenZ/comments/1lv0que/do_you_think_people_should_date_within_their/,0
GenZ,2025-07-08 19:29:33,Thank God I never had this,,https://v.redd.it/hkof11rbcpbf1,283
GenZ,2025-07-08 18:49:23,What does my clothing say about me?,"Im 16 and already own all of these except the black affliction shirt and was wondering how these make me come off as. I really like all the clothes and think they look great but I also think that maybe a lot of people would hate it. Im going to college in August and Im excited to meet new people but I dont want how I dress to make me unapproachable either. What do you guys think about the clothes I like? Also if it turns out you guys do like it, what other brands are there that have similar stuff?",https://www.reddit.com/gallery/1luwu5q,1
GenZ,2025-07-08 17:49:52,How relatable is this? I'm kinda agreeing,,https://i.redd.it/x9l7w23kuobf1.jpeg,1252
GenZ,2025-07-08 17:48:23,I made a movie alone about nostalgia and growing up as Gen-Z. It took me 2.5 years,,https://youtu.be/GAX9I8-r9BM?si=y82KYoCcV9Z3DoZQ,13
GenZ,2025-07-08 15:10:03,Gen Z is probably gonna be the generation with the lowest birth rate,"I mean can you blame us? we're facing one of the worst economies with a rising cost in living and no actual hope in the future being better. There's a reason people are living child free, but this is also from an American perspective, other countries birth rates probably won't drop.",https://www.reddit.com/r/GenZ/comments/1lur2x0/gen_z_is_probably_gonna_be_the_generation_with/,665
GenZ,2025-07-08 14:48:45,I'm worried about the future and how brainrot and AI may affect it,"I was watching a video about brainrot and how it is worrying, and that made me realise even more how bad it is. Just think about it. Now at days brainrot is very common, and it is spreading like Covid 19. I am worried about how this might affect the future allong with AI. Oh! And talikng about AI, I am worried about it too. Just look at how AI can generate pictures and f*cking videos. These videos aren't only ugly but they also can make people not get any job, like an artist or an animator. We must do something about this before it's too late. I have just got one thing to say: I hope the future is not f*cked up.",https://www.reddit.com/r/GenZ/comments/1luqivj/im_worried_about_the_future_and_how_brainrot_and/,4
GenZ,2025-07-08 14:09:31,What does TS mean?,Lets settle this once and for all. [View Poll](https://www.reddit.com/poll/1lupjl1),https://www.reddit.com/r/GenZ/comments/1lupjl1/what_does_ts_mean/,7
GenZ,2025-07-08 13:35:59,Rush Hour Movies,"Is anyone here actually offended by the comedy in the rush hour movies? Just curious, I find them hilarious but I keep seeing posts on IG about it.",https://www.reddit.com/r/GenZ/comments/1luoqu4/rush_hour_movies/,9
GenZ,2025-07-08 11:04:44,Being able to maintain friendships is really underrated skill.,"It's something that's never explicitly taught and when you don't know how or you don't know that you actively should maintain them, it can leave you very lonely later on in your life.",https://www.reddit.com/r/GenZ/comments/1lulp03/being_able_to_maintain_friendships_is_really/,26
GenZ,2025-07-08 10:08:41,Anyone else without plans for the future?,"And I don't mean deoressive ""Oh, I'm miserable and will rot alone!"" Rn I do have some mental problems, but I think I had such feeling even before. Like, I'm getting a university degree, everything's fine, but. For most of my life I just enjoyed playing videogames, watching anime and hanging out with my friends, and like... This is what I would like to have in my life. Family, kids, career? No, thanks. I don't look forward to any of it, just chilling is my goal in life, nothing more.",https://www.reddit.com/r/GenZ/comments/1lukro3/anyone_else_without_plans_for_the_future/,7
GenZ,2025-07-08 06:57:30,Is this enough fire power to restrain the demonic force from the bottle,,https://i.redd.it/vvx80xx5mlbf1.jpeg,76
GenZ,2025-07-08 06:30:47,What's your side hustles?,,https://www.reddit.com/r/GenZ/comments/1luhjll/whats_your_side_hustles/,4
GenZ,2025-07-08 04:57:48,Do Europeans just not care about their stuff getting stolen?,,https://www.reddit.com/gallery/1lug1r1,1504
GenZ,2025-07-08 04:31:21,"I'm sorry, what?","Saw the phrase ""I was cooked"" in a Royal Dahl book. Has this phrase really been around this long? I thought it was a Gen Z thing?",https://www.reddit.com/gallery/1lufl5n,245
GenZ,2025-07-08 04:20:11,Do all years seem identical to you?,"Probably a strange phrase, but I'll try to elaborate. I saw a post recently that asked ""does anyone think 2020 and 2021 feel identical?"" or smth and I thought ""Duh... Yeah they do, like any other year basically"". So, I wonder if anyone else don't have a specific ""vibe"" for each year. Or is it just me and I have a problem, idk",https://www.reddit.com/r/GenZ/comments/1lufe0p/do_all_years_seem_identical_to_you/,7
GenZ,2025-07-08 04:00:15,Are GenZ interested in baggy jeans?,My sister and I are trying to start buisness for GenZ and were wondering if going baggy jean route would be good. If you have a minute in your day could you please help us start out buisness by filling out this form?: [https://docs.google.com/forms/d/e/1FAIpQLSc-5pT6MbM8kLg5x7vjBn1GoePAR3-YAlS2eUyl7U2mbvO\_CA/viewform?usp=header](https://docs.google.com/forms/d/e/1FAIpQLSc-5pT6MbM8kLg5x7vjBn1GoePAR3-YAlS2eUyl7U2mbvO_CA/viewform?usp=header) Thank you so much :),https://www.reddit.com/r/GenZ/comments/1luf0st/are_genz_interested_in_baggy_jeans/,0
GenZ,2025-07-08 03:28:18,Is iphone 16pro cheaper on amazon prime or on black friday e.g. when 17 has came out?,,https://www.reddit.com/r/GenZ/comments/1luefam/is_iphone_16pro_cheaper_on_amazon_prime_or_on/,0
GenZ,2025-07-08 02:39:01,"Invest $100/month today, and you would have close to a million at 65 - Instagram","It's pretty messed up that they don't teach personal finance in school, but with time, I'm realizing it's easier than most people think. The sad thing is, I learned most of it through social media. I hope Y'all have a good week ahead!",https://www.reddit.com/r/GenZ/comments/1ludfut/invest_100month_today_and_you_would_have_close_to/,27
GenZ,2025-07-08 01:26:23,Saw this on W 53 st tonight,,https://i.redd.it/no92bjf3zjbf1.jpeg,128
GenZ,2025-07-08 00:34:52,Do people actually go to horse races,"Got grilled by my uncle (60+) after I politely asked if we could maybe switch the channel from horse racing to something more appealing to the entire family. Proceeded to have a long winded arguement of how horse racing is a gift from god, how our gen doesn't know whats good, etc, etc. Now I have to know- do any of you actually attend horse races, am I just ignorant?",https://www.reddit.com/r/GenZ/comments/1luavta/do_people_actually_go_to_horse_races/,32
GenZ,2025-07-08 00:00:59,thoughts and opinions on separating the art and artist,I cant do it in my opinion I listen to Kanye West quite a bit when I was younger but he went off on the deep end and I don't want to support him because it just gives him a platform to spread a terrible perspective that people would be influenced to follow. like his music is good but hes gone to far.,https://www.reddit.com/r/GenZ/comments/1lua5um/thoughts_and_opinions_on_separating_the_art_and/,3
GenZ,2025-07-07 22:54:40,The big question,"I'm in college; 21 and entering my sophomore year. I really need a job, and I'd want to know, what are some tips that helped you? Is college a liability (scheduling and stuff)? What are a few things that made your resume stand out?",https://www.reddit.com/r/GenZ/comments/1lu8om4/the_big_question/,0
GenZ,2025-07-07 22:11:25,Registration is another contribution to the GOF (Government Overreach Fund).,"I recently received a ticket for driving with expired tags (my fault, obviously) but I dont understand the need for registration to begin with. You mean that, I have to prove ownership on a yearly basis of a car that I own and pay taxes to drive on the road that I pay for, with a license that I also have to pay for, with insurance that I also pay for? I can somewhat get behind state inspection, but registration is nothing but a cash grab to fund more overreach. Why are we, as Americans, okay with the government having power to take our money if we havent decorated our car correctly? I will stew on this until I have the money to pay that fee every year as a statement. Sincerely, A disgruntled GenZ writing this on the toilet.",https://www.reddit.com/r/GenZ/comments/1lu7nuh/registration_is_another_contribution_to_the_gof/,0
GenZ,2025-07-07 22:08:19,"I hated this shit in school. Did it ever happen to any of you, too? Context: it's about pairing kids who excel at math with kids who DGAF",,https://i.redd.it/ch5zyealzibf1.png,409
GenZ,2025-07-07 20:04:19,Bygone Conclusion (Heat Damage): collage all made out of snippets of Nick Magazine scans,,https://i.redd.it/xwmkwwzmdibf1.jpeg,0
GenZ,2025-07-07 17:41:19,People who whine about family and friends that Shame them for unhealthy eating habits have no idea how blessed they are,"They have someone in their life that cares enough to kick you in the ass and tell them the truth, even if it hurts their feelings. They have the tools in place to get back on track if they ever find a break and are able. They dont understand how its like to be on the other end. They dont understand how fucking debilitating it is hearing them shit talk you everytime they see you eating vegetables, healthier meats, being mindful of fat and sugar. Tracking calories. Its debilitating, not once has anyone in my family ever said they were happy I began exercising or began eating healthy. After years of shit talking me behind my back for eating French fries and burgers and chicken nuggets all the time. I still enjoy these things but Im more mindful of them, in fact I cook them by myself sometimes, as a cheaper and healthier alternative. They dont know how horrible and evil it is to catch yourself binge eating, and have everyone you know not only unconcerned, but *encouraging* you and giving you more sweets and cookies and cakes. Youre not in your right mind, its like taking advantage of a drunk woman. You know how fucked it is, cant even have a single meal in peace without my father or mother or brother walking in going Youre a grown ass man, stop thinking about what you eat like gee, thanks, I dont want to look like any of you. How depressing it is, to have not once heard Im so glad my son is eating healthy/exercising or Im so glad my son has found a way to do it despite his responsibilities its some bullshit or its them using *my* responsibilities as an excuse to tell me to fucking give up. Or when they can, using whatever means they have over me to make it impossible for me to reach my goals for the day. Incredibly fucking infuriating watching your formally athletic little brother *still* eat like an athlete, then wonder Why oh why is my black ass getting fat then try every trick in the book (Keto, low carb, trying to exercise his calories off, eating tiny amounts of junk food) instead of just tracking what he eats or eating healthier. But he cries and sobs when Im Too prideful to take his advice to just sit on my fucking ass and eat like a slob because Im smaller than him like no shot man youre six fooot two and have been training for basketball before your balls dropped. Im five foot eight and all I used to do was play Sonic the hedgehog. Of course youre bigger, in face, youre still getting bigger, not in a good way To hear your fatass +300lbs Buffon of a father talk you down because fiber is bad for you apparently, because it Catches food then spits it out, telling you bodybuilders like the rock eat 7000 calories a day to Recover from a measly 2 mile walk. And how I need to eat 5000 everyday if I were sitting on my fucking ass all day not working out. And I ought do 10k because I am. All of this while youre consistently gaining muscle/weight on a lean bulk of 2.7k-3k calories BECAUSE you walk 20k steps a day and lift 3 times a week. They dont believe it How fucking insane it is to have been overweight (175lbs, 20M, 5'8) and *still* considered tiny and skinny compared to the rest of them. Being told Im Sickly and Anorexic at 160, because I knew theyd lose their shit if I told them I was 150lbs. I went from 138 to 147 now after a slow lean bulk over 6 months (Albiet a couple of binging days) and they still dont see it. Im still the eternally anorexic girl-man to them. But Im feeling the effects of extra weight, weirdness and discomfort. In addition to some muscle gain. I dont understand how you can live being over 200lbs. how I ever lived at my previous weight You have no idea how blessed you are to have someone there to kick you in the ass when youre eating like shit. When youre inconsistent with exercise. It hurts your feelings, sure, but they love you. Thats why they tell you these things. Doesnt mean theyre *correct*, doesnt mean that *Their* way of being healthy is what you should do. But its proof they love you. Ive been sabotaged, limited, socially isolated and manipulated by my parents for so long and Im only now noticing it. My older sis has been trying to tell us for years but wed never listen. Id never listen. I can trust theyll want me to move out, but looking back at all the opportunities I missed because of fire bullshit they may provide for me, but they dont seem to want me to provide for myself. They shame me for it. But shame me everytime I take a step to get out of this hellhole. Maybe theyre doing all this for us because they feel guilty. Not out of love. That I even have to question if they Ive me or not, and it all started with my health journey.",https://www.reddit.com/r/GenZ/comments/1lu0oih/people_who_whine_about_family_and_friends_that/,8
GenZ,2025-07-07 16:28:46,"If you know, you know",,https://i.redd.it/blsxx8i6bhbf1.jpeg,151
GenZ,2025-07-07 16:28:17,How are we gonna tell Gen alpha about how fucked the world is,I mean seriously. With how everything is and what its going to turn into? Theres no leg to lean on and theres no arm to reach up idk just a vent. I cant think of anything rn unfortunately,https://www.reddit.com/r/GenZ/comments/1ltypvm/how_are_we_gonna_tell_gen_alpha_about_how_fucked/,0
GenZ,2025-07-07 15:42:00,Favorite Music Artist,"I saw a post of someone asking her your hated musician is, how about your favorites that are underrated or unknown. Mine as of right now are Elliot James Reay and Zach Top.",https://www.reddit.com/r/GenZ/comments/1ltxhz8/favorite_music_artist/,3
GenZ,2025-07-07 15:37:19,"New dad, feeling hopeless","I used to be so excited for the future of watching my son grow up, turn into a whole person with dreams and passions and now I just feel dread all the time. Were a single income family, still live with my parents and over the last two years I managed to pay off all of my debts and raise my credit score a good amount, now I feel like all of that hardwork was for nothing. Now I have to worry about raising my kid under authoritarian rule, this budget bill is going to dramatically disrupt our futures, I have to worry about a literal gestapo going around disappearing people, my kids education is getting gutted, the country is literally on fire or flooding or getting ripped apart by hurricanes. Like how am I supposed to raise a family through this? We wanted to have more kids once our current one turns 3 (next year) and now I don't think we're ever going to have another kid. If it wasn't for the fact that I love my wife and child so much I think I would have given up by now. Idk how much longer I can keep going.",https://www.reddit.com/r/GenZ/comments/1ltxdms/new_dad_feeling_hopeless/,1
GenZ,2025-07-07 14:16:08,Technological progress is moving at a blistering pace.,"This photo is from an article by UnionRayo about Amazon deploying robots to their UK warehouses. Less than a decade ago, people would frequently dismiss the idea that robots would replace humans in the work force. It seems like more ""that won't happen for another century"" takes fold like a house of cards in the wind. What do my fellow Gen Zers think of the future of tech right now? Are you optimistic? Pessimistic? Maybe both?",https://i.redd.it/oeog7ewkmgbf1.jpeg,196
GenZ,2025-07-07 14:02:55,Post the best meme you have on your phone.,,https://i.redd.it/yzjuttm5lgbf1.jpeg,509
GenZ,2025-07-07 13:54:47,"How large is your family, and how large was the biggest family you met","I live with 8 people, and the largest family I met was a girl I knew, who had 10 siblings and two parents, 12 people overall.",https://www.reddit.com/r/GenZ/comments/1ltuse6/how_large_is_your_family_and_how_large_was_the/,2
GenZ,2025-07-07 13:37:12,why is this normalized?,,https://i.redd.it/zp5rmwbkggbf1.jpeg,718
GenZ,2025-07-07 12:49:40,Is this it for me?,"I'm 25 years old, dropped out of college making 18 an hour, burnt out, depressed and tired. I can't make friends because I hate everyone and everything around me, and the only thing I really do is smoke weed and play ps5 while waiting for my body to die. I hate the position i'm in. I don't have a license, and my family can't help me either. I'm on my own, what do I do? Or is this just it for me? And i'm fucked? Edit: i'm in nyc. Edit 2: Thank you all for your comments, i'm going to try my hardest to improve my life, albeit one day at a time, I'm genuinely grateful for the advice.",https://www.reddit.com/r/GenZ/comments/1lttbeh/is_this_it_for_me/,772
