subreddit,date,title,content,url,score
GenZ,2025-07-11 20:28:17,So whata gonna happen when nobody can afford to live? What happens next?,"I dont need to mention how things are getting worse. We all know the economy is bad, the future looks bleak with AI and Blackrock. I just dont know how this ends or transitions into something else? Are us Westerners gonna have to move to Somalia just to be able to afford life? Is there going to be a French Revolution 2.0? Is there going to be a civil war? All I know is, this cant continue the way its been going. And it wont. Change is the only constant. My prediction is, America votes for more government control after the Boomers die. This means we will have universal health care, free college, and some sort of housing cost control. Its going to be hell for the next 20-30 years. There may be short term prosperity for 10-15 years, then it will be hell again when the US dollar is worth nothing after they run out of money for their programs.",https://www.reddit.com/r/GenZ/comments/1lxhh27/so_whata_gonna_happen_when_nobody_can_afford_to/,1277
GenZ,2025-07-11 19:54:58,The NFA is no longer constitutional,I will make this short for yall. The NFA was constitutional since it was a tax on certain weapons or parts but now that the big beautiful bill has passed and changed the tax to zero it isn't a tax anymore it's just a gun registry which is unconstitutional meaning most likely the NFA will be abolished when it comes to weapon restrictions.,https://www.reddit.com/r/GenZ/comments/1lxgnfg/the_nfa_is_no_longer_constitutional/,32
GenZ,2025-07-11 19:50:34,Gen Z childhood icon Bill Nye states that recent floods are caused by climate change and that we must act to stop funding cuts to crucial programs that would protect us from more climate disasters(such as alt energy programs & NASA). Any gen z have plans to work towards these or lower c-footprints ?,,https://www.reddit.com/gallery/1lxgjmy,18
GenZ,2025-07-11 18:45:14,"Im a Russian GenZ, and since Im bored again I want to answer your questions again.",,https://i.redd.it/sn95rd66jacf1.jpeg,142
GenZ,2025-07-11 18:40:38,Is Gen z stare real? Why do you do that?,My theory is under stimulation from the real world,https://www.reddit.com/r/GenZ/comments/1lxes8a/is_gen_z_stare_real_why_do_you_do_that/,10
GenZ,2025-07-11 18:20:18,Do you notice people now seem to be jealous of a 2000s childhood?,"Not too long ago, we were always told that you had a sucky childhood if you were a 2000s kid and that we missed out on the 90s. People were jealous of a 90s childhood. It seems now thats shifted to the 2000s with people being jealous of a 2000s childhood lol.",https://www.reddit.com/r/GenZ/comments/1lxe9vg/do_you_notice_people_now_seem_to_be_jealous_of_a/,8
GenZ,2025-07-11 17:57:19,Do you miss summer as a kid?,We would play in the pool all day long all summer long. When we took breaks wed eat watermelon and cucumbers and drink ice old water. Those were the days,https://www.reddit.com/r/GenZ/comments/1lxdopf/do_you_miss_summer_as_a_kid/,1
GenZ,2025-07-11 17:28:34,Would yall perfer there be a monthly fee to use things like youtube/ facebook/ reddit if it ment it was illegal for these websites to sell your information to other companies/ nations?,Like a reason why youtube has a monopoly is because it is not competing by price unlike most servies. Instead it gives you a free service but sells your information to companies which in turn make ads that is designed for you. This results in some ethical debates as well you use these websites and give it information that you wouldnt tell your closes friends. On top of that it is impossible for there to be competition as if you had a choice between two companies that are free you would pick what is something that you have always used. On the other hand having monthly payments would be annying in a pay by month service world. It could also price out those in poverty that cant afford the monthly subscriptions.,https://www.reddit.com/r/GenZ/comments/1lxcyip/would_yall_perfer_there_be_a_monthly_fee_to_use/,1
GenZ,2025-07-11 17:25:09,crashing out,"aye tfw youre just zoinked out on the public restroom at a family establishment just transcending meditation cultivating seven chakras and perceiving the eighth while hitting pure enlightenment and opening up your eyes, see that youre actually for skin care you just shield out $20 for but still dont wanna pay those fkin ai apps for answers to bs syllabus hw",https://www.reddit.com/r/GenZ/comments/1lxcvdo/crashing_out/,0
GenZ,2025-07-11 17:15:53,"Got Promoted, But Unsure If the New Title Reflects My Actual Role Should I Update My Resume?","I was promoted in April from Accounting Assistant to Assistant Accounting Manager at a small travel agency. Ive been with the company for 2 years. While the title changed, most of my day-to-day tasks remain the same, mainly AP/AR, with the addition of credit card reconciliation. When I looked up Assistant Accounting Manager roles on LinkedIn and Indeed, most postings ask for 510 years of experience and involve much broader responsibilities. Now Im unsure if I should list this new title on my resume as-is, or adjust it to better reflect what I actually do. Has anyone else been in a similar situation? Would using the official title be misleading, or is it okay since it was a formal promotion?",https://www.reddit.com/r/GenZ/comments/1lxcmn8/got_promoted_but_unsure_if_the_new_title_reflects/,1
GenZ,2025-07-11 16:49:06,"Found this small channel with vlog type content, cool stuff.",Cool film style thought you guys should check it out!!,https://youtu.be/TAsxYX3wJMU,1
GenZ,2025-07-11 16:26:30,going to midnight game console releases was a fever dream,,https://www.reddit.com/gallery/1lxbckc,21
GenZ,2025-07-11 15:44:17,Doing some research: Approaching people IRL,"Hey all, Im currently doing some research to learn more about the Anxious Generation specifically looking at meeting people IRL. I notice that my grandads generation find it so easy to start talking to strangers, literally well go out for a meal somewhere and within minutes hes talking to everyone! But it seems the younger you are, the harder it becomes to connect. Where I notice it loads is in the gym, literally everyone there has their headphones on and stares at their phone in between sets. But personally Id love it if my gym was more a community and just general places IRL QUESTION Do you struggle to break the ice with people socially and do you often wish it were easier?",https://www.reddit.com/r/GenZ/comments/1lxa906/doing_some_research_approaching_people_irl/,1
GenZ,2025-07-11 15:34:58,Its just a lustful tv show,,https://v.redd.it/qahv9ed7l9cf1,154
GenZ,2025-07-11 15:30:21,My experience with Gen Z stare!,,https://v.redd.it/jaj1wo1dk9cf1,1712
GenZ,2025-07-11 15:28:45,Thoughts on the current state of music in 2025?,,https://i.redd.it/78i2y644k9cf1.jpeg,86
GenZ,2025-07-11 15:14:06,"Does Gen Z still listen to Emo Rap? (Juice WRLD, X, etc.)",,https://www.reddit.com/r/GenZ/comments/1lx9h06/does_gen_z_still_listen_to_emo_rap_juice_wrld_x/,1
GenZ,2025-07-11 15:12:04,"How do I cope with the fact that I will have to spend the rest of my life doing monotonous, manual labour?","Is it over for me? I did not make good use out of university. That means my only option in life is monotonous labour. Is that even a life worth living? Spending half your waking hours experiencing discomfort. It is hard to have a good social life with that lifestyle, as dating will be hard as a manual laborer since most women are doing better jobs. I will never be high society. Everyone who picked a good degree gets to be part of high society, but not me. All I had to do was do a better degree or do a little better in this degree",https://www.reddit.com/r/GenZ/comments/1lx9f4m/how_do_i_cope_with_the_fact_that_i_will_have_to/,0
GenZ,2025-07-11 14:30:13,can we not condone this behavior,I feel like this is just common sense and not smoke on a job that consists of patients health. Whats more concerning is people our age joking and validating this behavior. Have we really gotten to the point in our generation where being intoxicated is more important than a life on your hands? PSA: You dont have to be a doctor or a nurse to be apart of a patients care team. You also dont have to be a doctor or a nurse to save someones life.,https://i.redd.it/2xjxt4bo99cf1.jpeg,1091
GenZ,2025-07-11 13:12:47,"Did ever ask questions like ""Describe me according to your collected data"" on AI platforms?",,https://www.reddit.com/r/GenZ/comments/1lx6k9z/did_ever_ask_questions_like_describe_me_according/,0
GenZ,2025-07-11 12:08:54,Does anyone here still have faith in Jesus?,,https://i.redd.it/m44bhaqgk8cf1.jpeg,0
GenZ,2025-07-11 12:01:36,Spiking my friends drinks to show them how easy it is...,,https://youtu.be/xj6J4yJhGc4?si=k0EYn8ggk5l19W8R,1
GenZ,2025-07-11 11:02:15,What is the 2025 equivalent of this?,,https://v.redd.it/e5q2huqj88cf1,59
GenZ,2025-07-11 10:53:17,"Do you currently use a dumb phone, or are you thinking about switching to one?",,https://i.redd.it/7f3tnvvw68cf1.png,228
GenZ,2025-07-11 09:47:26,how old am i based on my apps/home page :3,,https://i.redd.it/v1cztl58v7cf1.jpeg,0
GenZ,2025-07-11 09:19:06,Young people at church,"I regularly go to church, and I notice more and more young people in it. I do however see a gender disparity. More women, on average, are in church. Like, solid 60/40 women's favor. Is this just me or is it this a generally happening phenomena? (Eastern Europe, Eastern Orthodox)",https://i.redd.it/ada39y06q7cf1.gif,641
GenZ,2025-07-11 09:04:40,Need to get hired?,https://www.wsj.com/lifestyle/careers/job-listings-labor-market-373b4331?reflink=desktopwebshare_permalink,https://i.redd.it/ak0wrzaln7cf1.jpeg,136
GenZ,2025-07-11 05:52:05,Music has gotten so bad,,https://i.redd.it/tav960w4p6cf1.jpeg,1628
GenZ,2025-07-11 03:22:05,I still believe in super hero movies,Who's with me?,https://i.redd.it/7y04d5lgy5cf1.jpeg,25
GenZ,2025-07-11 03:19:11,Whats the prime age to lock in and go all-in on your calling?,"It started in a university cafeteria. Five of us grad students killing time over wilting fries were stuck in a looping argument: is there an age by which youre supposed to get serious? Gates shipped Microsoft at 20, Zuckerberg launched Facebook at 19, but Berners-Lee named the World Wide Web during coffee breaks in his thirties. Tools: Python + pandas for scraping/clean-up, a shared Colab notebook, and way too much Wikipedia/Forbes/IMDb parsing , LLMs(Claude api) In short: one cafeteria debate, a few late-night scrapes, and we turned conjecture into data If you need further motivation a tool: https://apps.apple.com/in/app/lockin-daily-track-time/id6743713321",https://www.reddit.com/gallery/1lwweoo,11
GenZ,2025-07-11 03:17:41,Hot Take: I actually liked the pandemic,"Everyday, I see people here and beyond talking about how detrimental the pandemic was to society, particularly Gen Z, but the truth is, I personally really liked the pandemic. Now obviously I did not like the deaths that COVID brought. Instead, I will be discussing the lockdown it brought. This is all my personal experience, although Im sure theres some that will relate. Essentially, my life wasnt that different from the one the pandemic brought upon the rest of the world. All my life, I had been bullied at school. I hated going outside, and while I did enjoy school, I would have preferred doing it online. When the lockdown came, it was heaven for me. The whole world got to see and experience the world through my lenses. It was nice knowing people knew what it was like to be home all day, to cut constant interaction with others. Not having to go outside. Staying home all day long, being safe. And I made more friends online than I would ever have made in person. The pandemic basically helped me, gave me some peace of mind. People always complain that the pandemic ruined their social lives, but COVID did the opposite to me. To this day, all my friends are online friends, simply because no one ever wanted to hang out with me physically. And Im okay with that, having unconventional friends is better than having none. Lastly, the pandemic was just a very fun time for me. Having so much time meant more time to explore new things, which for me included making YouTube videos. And while I dont do that anymore, I never would have even considered that had it not been for the spare time the pandemic brought. And quite frankly, if another pandemic happened, I would feel the same way. I know many people will disagree, but I do honestly think people only talk about how bad the pandemic was and forget about any good things that may have occurred during the time. Tl;dr: The pandemic was an introverts dream. No social interaction for a time was really refreshing.",https://www.reddit.com/r/GenZ/comments/1lwwdme/hot_take_i_actually_liked_the_pandemic/,77
GenZ,2025-07-11 01:58:38,Am i doing something wrong?,"For your information, I'm 23 years old in a Master's degree program about to finish without a job and only exercising in the mornings, but I'm building my own business in my city as the job market is shit I'm trying to date a dentist's assistant I met last month on Tik Tok, we have conversations every day. However, I'm confused about whether she likes me and if I'm doing things right to get her fall in love with me or ask her out at least She texts me every day the Good Morning she always asks me how my day is going and how I'm going and what I eat and what I do and things of my day to day, but it bothers me that every now and then she tells me ""sorry for not answering"" ""sorry, I didn't see your message"" and things like that, I really can't stand it because she is a busy girl in her high-demand job and who also goes out with her friends from time to time. I asume that because of her job that she takes hours to answer my messages and that is not a problem for me. Yesterday I made her food so she didn't buy at Uber Eats because she doesn't bring lunch, she liked my food she said that I also gave her some chocolate kisses. The idea of being sent so many apologies makes me feel bad as if I'm harassing her with my messages, it's the first time this situation happens to me and I don't know what to do. What do you think? What should you do or what do you is going on in her mind?",https://www.reddit.com/r/GenZ/comments/1lwurwf/am_i_doing_something_wrong/,2
GenZ,2025-07-11 01:03:17,Being 19 sucks lol,"Youre too old for teenage spaces but too young for serious adult spaces. Im legally held accountable as an adult but am legally locked out of 21+ spaces. Especially online, 18+ platforms lack rigorous verification and are filled with teens lying about their age. What makes it worse is that teens can not only lie about how old they are, but make advances towards adults, and thats scary. The 18-20 range truly sucks. Please be mindful of the content, humor, and people you speak to on the internet. Never discuss nsfw topics anywhere but 18+ spaces. Never assume someone is the age they claim. Someone sending you something nsfw doesnt mean you should reciprocate.",https://www.reddit.com/r/GenZ/comments/1lwtn3l/being_19_sucks_lol/,75
GenZ,2025-07-11 00:36:43,Am I too old to have these?,The only reason I have them is because Im a Star Wars fan,https://i.redd.it/g9tgurwy45cf1.jpeg,48
GenZ,2025-07-10 23:13:23,When was the last time you went to the doctor / had a physical?,"Its been about 3 or 4 years since I last seen a doctor. Im punctual when it comes to dentist visits, I go every 6 months for a check up and cleaning. But the doctor different story. Doesnt help I dont have health insurance, only dental. Luckily nothing hurts yet.",https://www.reddit.com/r/GenZ/comments/1lwraj2/when_was_the_last_time_you_went_to_the_doctor_had/,1
GenZ,2025-07-10 22:32:05,Is GenZ still religious,"Millennial here, and Im genuinely curious. When I was growing up I was basically forced to go to church twice a week, Christianity constantly being shoved down my throat. Being able to break away and follow my own spiritual path (or lack thereof) was a real struggle. Is it the same for you? Do your parents push you to be religious at all? Ive always imagined that because of such ready access to technology, the idea of having faith in something higher would seem odd from an early age. UPDATE: After reading everyones answer I have determined that everything is exactly the same as before.",https://www.reddit.com/r/GenZ/comments/1lwqbu4/is_genz_still_religious/,277
GenZ,2025-07-10 22:27:45,Am I ready for parenthood or am I unfulfilled?,"As a nearly 30 yo female I'm very aware that my body is telling me to procreate for biological reasons. I don't feel so much societal pressure to have a kid as I expected to, which is a great thing for our generation, but I'm really confused about whether I want a baby for the right reasons. I've always been incredibly maternal, and couldn't wait to be pregnant/become a mother growing up. I have a natural affinity for children and have felt very at peace dealing with babies and young kids since I was barely a teen myself. For many years I've been convinced I wouldn't have them, mostly due to state of the climate, national economy, maternity packages in the countries I'd have an opportunity to raise them in, and personal/family history of both myself and my partners' mental health. I've suffered with depression in the past and have come along way but still feel this undeniable base level of sadness/unfulfillment. I've worked hard and gained a fair few qualifications, done lots of voluntary work, and have a great support system of family and friends, i.e. I've taken the obvious steps alongside having rewarding hobbies and years of therapy to feel ""whole"" and enjoy life, and this feeling had been part of reason I didn't want to have kids, but I'm wondering now whether it's exactly the reason I should. I'm quite confident that having a child would give me a purpose in life and help to light up my world, but this always seemed like a really selfish and arguably inappropriate reason to do it. However, I'm now wondering whether it's entirely natural that I would feel this way as our innate urge to procreate does still exist in most of us, and perhaps there's nothing wrong with requiring this element in life to feel fulfilled. Does anyone else have a similar take?",https://www.reddit.com/r/GenZ/comments/1lwq81y/am_i_ready_for_parenthood_or_am_i_unfulfilled/,3
GenZ,2025-07-10 22:26:12,My PS3 Died,"It died after a week ago. I had it for about ten years I served me well, I currently have an Xbox One",https://i.redd.it/4m9ysghoh4cf1.jpeg,36
GenZ,2025-07-10 21:52:17,Thats why.,,https://www.reddit.com/gallery/1lwpddk,411
GenZ,2025-07-10 21:15:04,Tell me how about how old you are without telling me,Ill go first. I still sometimes call it Battle Ready Amour,https://www.reddit.com/r/GenZ/comments/1lwogtj/tell_me_how_about_how_old_you_are_without_telling/,12
GenZ,2025-07-10 20:35:46,Why are millennials so lazy when it comes to fitness?,Asking this because I (2000 born) am really into fitness. I lift weights 5 times a week and run 90 minutes 4 times a week. But my older brothers (1986 and 1991 born) both dont workout as much. The 1986 born only works out when he has a gym trainer but as soon as he stops using one he stops working out (I dont use trainers) the 1991 born is just overweight and never works out. Why are millennials so lazy when it comes to fitness?,https://www.reddit.com/r/GenZ/comments/1lwnhl1/why_are_millennials_so_lazy_when_it_comes_to/,0
GenZ,2025-07-10 20:33:32,Anyone remember this Adobe flash game?,"I bet EVERYONE has played some sort of game like this on random websites or Adobe flash. Just like fireboy and water girl, snail bob etc. But this is way more less talked about. I genuinely thought this was lost media till I found clips of it and the website. 2014-2018 those were the days",https://i.redd.it/g64l8pwkx3cf1.png,11
GenZ,2025-07-10 20:26:14,why does this feel like too much are you all drinking the recommended amount of water daily?,,https://i.redd.it/kyg0nc3aw3cf1.jpeg,375
GenZ,2025-07-10 19:35:24,Future,"Hi. I am a boomer, not rich and don't feel entitled. But I've been thinking about today's youth. Your future is so uncertain, this is really the definition of ""muddy water"". The powers that be try to bring back something we are so over with. They want you to work in a factory, for minimum wages, be a good little slave and do the same thing day in day out. Don't do it. Study as much as you can, in case the US universities go sideways, there are always the foreign ones: Oxford, Sorbonne, SOTE, just to name s few. But get your education, have is power and choose a way to utilize it to build robots that do the grind work for example. You don't have to go to trade school or anything like this. You were born into a world that runs forward with technology everywhere. And a bunch of people who know nothing about it but want to rule it. You have the advantage there, take it. Good luck to you and a great life that you can get by doing it your way!",https://www.reddit.com/r/GenZ/comments/1lwly1q/future/,2
GenZ,2025-07-10 19:23:19,did you ever use the app yubo?,"It was that app that was basically a Tinder-type thing, but for kids to make friends on. Only one of my friends ever had it, and I thought it was stupid. I made a troll account on there once, but I don't remember the login in so I guess somewhere on the app there is a photo of my friend edited to be shirtless and jacked. I also made a tinder troll account with this friends photos but I kept on getting middle aged men, I didnt understand how to work the settings lol.",https://www.reddit.com/r/GenZ/comments/1lwlnad/did_you_ever_use_the_app_yubo/,0
GenZ,2025-07-10 18:39:46,Heres some of my Nostalgic/comfort stuff,,https://www.reddit.com/gallery/1lwkjfm,8
GenZ,2025-07-10 17:18:52,AI will replace the man behind the curtain.,,https://www.reddit.com/r/GenZ/comments/1lwifzs/ai_will_replace_the_man_behind_the_curtain/,0
GenZ,2025-07-10 17:11:04,Can I put a master's degree on my resume if the program hasnt started yet?,"Ive been accepted into a Master of Accounting program that starts in Fall 2025. Im currently job hunting for a role thats closer to the school. Im still working full-time but planning to leave soon. Is it okay to include the master's program on my resume even though it hasnt started yet? If so, whats the best way to list it?",https://www.reddit.com/r/GenZ/comments/1lwi8ru/can_i_put_a_masters_degree_on_my_resume_if_the/,0
GenZ,2025-07-10 16:50:55,What do you think about labor unions? And being represented by a union?,,https://i.redd.it/ncr3736vt2cf1.png,245
GenZ,2025-07-10 16:08:28,FUCKZILLA.Add this to the dictionary,,https://i.redd.it/pomtmalam2cf1.jpeg,0
GenZ,2025-07-10 15:54:24,What did the Costco guys do tho???,,https://i.redd.it/1jxxc80sj2cf1.png,2840
GenZ,2025-07-10 15:20:40,Gen Z is socializing much less than prior generations.,,https://i.redd.it/jj5xpaqpd2cf1.jpeg,312
GenZ,2025-07-10 15:05:27,"Yall remember those ""humor stuck in 2016"" kids?","I can't wait for ""humor stuck in 2022"" kids *Fart sound* OHHHHHHHHH MAH GODDDDDD *vine boom* Sussy baka. Qing Cheng Han Chi Chun Kitchen in the dungeon. ITS MORBIN TIME. *Siren sound* WENAMECHAINTHESUMA",https://www.reddit.com/r/GenZ/comments/1lwf21j/yall_remember_those_humor_stuck_in_2016_kids/,3
GenZ,2025-07-10 14:45:14,Completely agree on this. Life isn't the same after covid. How about you?,,https://i.redd.it/ugri0fqf72cf1.jpeg,68
GenZ,2025-07-10 14:11:52,What's your least favourite fruit?,,https://i.redd.it/q7kybhoh12cf1.jpeg,90
GenZ,2025-07-10 14:08:58,We really are doomed...,,https://i.redd.it/q3eukp7x02cf1.png,1673
GenZ,2025-07-10 12:45:49,"Married zoomers, how is your marriage?",,https://www.reddit.com/r/GenZ/comments/1lwbt9i/married_zoomers_how_is_your_marriage/,0
GenZ,2025-07-10 12:17:10,Does anyone feel like they can't connect with our generation?,Pretty much since I started high school was when I got a gist of our culture and made me notice how I just hate it. Our humor is just not that funny. Most shows you guys seem to like are mostly meh. Even the songs we like I'm not interested in as they all sound mostly the same. Heck are generation feels too built on 2000s nostalgia which as an 08 I can't relate too.,https://www.reddit.com/r/GenZ/comments/1lwb86h/does_anyone_feel_like_they_cant_connect_with_our/,0
GenZ,2025-07-10 09:39:13,What are your opinions on the severe oppression of the Uyghurs in China at the moment?,"""The Uyghurs, a predominantly Muslim ethnic group in China's Xinjiang region, face severe oppression, including arbitrary detention in reeducation camps, forced labor, and restrictions on their religious and cultural practices. Human rights organizations and several countries have accused China of committing genocide and crimes against humanity against the Uyghur population."" -ChatGPT w/ Wikipedia, BBC News, Amnesty international mentioned as a few cited sources. This situation only just recently came to my attention, I'm surprised there isn't more coverage about this alongside some of the other things happening worldwide like the Sudanese civil war for example. But what do you guys think about all of this? Who's to blame? Why is the Chinese government perpetrating this whole situation? How can the situation come to an end?",https://www.reddit.com/r/GenZ/comments/1lw8ia3/what_are_your_opinions_on_the_severe_oppression/,0
GenZ,2025-07-10 09:09:15,I can't believe we used to fw these videos,,https://i.redd.it/hnory2uhj0cf1.jpeg,6
