subreddit,date,title,content,url,score
GenZ,2025-07-10 08:32:46,Is it normal to struggle finding a long term job?,Im 20 and just quit a warehouse job. Ive worked 4 jobs already and recently they've been getting in shorter stints. Longest job was 8 months at walmart that i quit bc of a breakup. Shortly after that I did tire technician work for 3 months but quit bc on top of roadside we were also expected to do the maintenance teams job and clean truckers sh*t (not metaphorically either). I tried a sales job at my mother's recommendation despite me suggesting I wouldn't work well in that field (bad social anxiety) and surprise it wasn't a good fit. Took a month or two but then I found a factory job. I was desperate so I said yes but I didn't realize I'd be so tired I'd come home shower and then sleep till my next shift regularly. I tried it but it just got to be too much. Ive gone back to looking but there's just nothing around. Im in a small area so it doesn't help but all I see is sales and the worst most physically demanding jobs u can think of. Im applying to some of the better looking break ur back core type jobs but is it this bad everywhere? Is it just bad luck or is this all there? How do u find a job that is worth staying or atleast decent enough u stay bc its better then the rest?,https://www.reddit.com/r/GenZ/comments/1lw7jej/is_it_normal_to_struggle_finding_a_long_term_job/,0
GenZ,2025-07-10 07:45:52,Which is the best to u?,,https://i.redd.it/8i276uhm40cf1.jpeg,8
GenZ,2025-07-10 06:56:55,Do people still write in diaries?,"This sounds random as hell, but I saw my cousin reading diary of a wimpy kid and I got flashbacks from when I used to read them. Have you guys ever wrote in a diary?",https://www.reddit.com/r/GenZ/comments/1lw64q3/do_people_still_write_in_diaries/,3
GenZ,2025-07-10 06:28:54,pov: you woke up and its 2016 all over again,,https://v.redd.it/ulws5zrqqzbf1,13
GenZ,2025-07-10 06:24:46,Feeling nostalgic over Minecraft,"My oldest kid wanted to watch the new movie, despite never playing the game. It made me think about how the game felt when I first started playing. Also a conversation about the MegaMan BattleNetwork series at work sparked up, which got me in the nostalgic mood. It's insane that a few of you weren't alive when I was playing the 1.4 beta in 2011. The game had a large following even before release. Redstone was fairly new, and I think piston's were just released. I remember staying up trying to figure out how to make double doors open with pressure plates at the *same* time. I don't enjoy that the caves now seem overly ubuiqitous, like a chore to venture, rather than a treat to find. I remember the old trick, where you had to press f11 (I think) and one of the graphs would spike in the direction of the cave. The content surrounding Minecraft was also semi-pleasant. [Like when Carl from The Walking Dead played Minecraft](https://youtu.be/WzZXbtr1dMs?si=hCMnrM47nnJn0Y1p). Back when you had to get frapps (or find a cracked version) before OBS became known or was available. I'm happy the community exists still, and new things are being added to it to this day. It even more pleases me that legacy versions ([like 1.4 beta](https://minecraft.fandom.com/wiki/Java_Edition_Beta_1.4)) are available for easy download. Anyways, just feeling nostalgic, wondering if anyone else has such a pleasant memory like mine. Frapps wasn't pleasant though. OBS is a f*cking God send. Many of you youngin's don't know how difficult it was to record your own screen before OBS.",https://www.reddit.com/r/GenZ/comments/1lw5mky/feeling_nostalgic_over_minecraft/,0
GenZ,2025-07-10 05:20:00,"As Gen Z, what are some of your favourite beverages and snacks, especially with how costly everything is?","Mine would probably be stuffed Jalapenos, wrapped in bacon. I can get all the ingredients for anywhere between 5 to 10 dollars, and it can last me a few days as an appetizer or as a snack to munch on throughout the day. Helps a lot as I work paycheque to paycheque with rising costs across various industries, both for still being a bit cheap, ingredients can be used for other dishes, and to just have a mental boost with one of my favourite snacks.",https://www.reddit.com/r/GenZ/comments/1lw4lab/as_gen_z_what_are_some_of_your_favourite/,1
GenZ,2025-07-10 05:02:01,Why do boomer think their music is automatically better?,,https://i.redd.it/ard7p25bbzbf1.png,175
GenZ,2025-07-10 03:04:19,I love them blobs,,https://v.redd.it/njujmjrcqybf1,58
GenZ,2025-07-10 02:48:38,"What's the women's equivalent of the performative matcha-drinking, tote-bag-wearing men meme?","There's a performative man stereotype of matcha drinking, tote bags, pretending to read deep things, wired earphones, only listening to CDs of Clairo, beabadoobee, and Laufey, etc. and I was wondering if there is a similarly light-hearted equivalent for women. Edit: wrote meme in the title but perhaps the more appropriate term would be stereotype?",https://www.reddit.com/r/GenZ/comments/1lw1umt/whats_the_womens_equivalent_of_the_performative/,4
GenZ,2025-07-10 02:35:25,I hate how our generation treats 20s like were elders,"I have friends in their early and mid 20s complaining all the time about how old they are now. I worked a job for a year and a half and I was the second youngest there at 25. (Youngest was 19. On average most coworkers were in their mid 30s, it was a small town restaurant.) and they have me some real perspective about how young your 20s really are especially once you hit 30 and 40 and how not to view it as being old already",https://www.reddit.com/r/GenZ/comments/1lw1l6a/i_hate_how_our_generation_treats_20s_like_were/,139
GenZ,2025-07-10 02:32:59,Who is this? Right answers only. (No reverse image search),,https://i.redd.it/f5mk37iskybf1.jpeg,7
GenZ,2025-07-10 01:57:50,The Video Game Symphony was featured on PBS ahead of our Severance Hall debut!,"The Video Game Symphony was so honored to be featured on Ideastream's Applause in advance of our historic debut at Severance Music Center on Sunday, August 24, 2025. We also received a fantastic radio feature on NPR's All Things Considered, along with a great print story! Check out all three of these incredible features (video, audio, and print) in one place here! https://www.ideastream.org/2025-06-13/for-this-ohio-orchestra-video-game-classics-are-the-perfect-score And don't miss the Video Game Symphony's electrifying upcoming performance at Severance Music Center on Sunday, August 24, 2025 at 3 PM! https://www.clevelandorchestra.com/attend/concerts-and-events/2526/other-events/video-game-symphony",https://www.reddit.com/r/GenZ/comments/1lw0tuf/the_video_game_symphony_was_featured_on_pbs_ahead/,2
GenZ,2025-07-10 01:55:33,Anyone think Gen Alpha came too soon?,"I feel like in 2018 we were just starting to get used to the concept of GenZ and then all the sudden we are talking about Gen Alpha?? Is time just really going by that quickly? Gen Z wasnt even really a thing until the mid 2010s. Up until then, adults always called my generation Millennials (Im 1998). Im not ready for there to already be a generation younger than me that is old enough to be on reddit",https://www.reddit.com/r/GenZ/comments/1lw0s7k/anyone_think_gen_alpha_came_too_soon/,1
GenZ,2025-07-10 00:36:53,"Gen Z returning to alcohol, smoking, partying","A few years ago, we were widely considered the 'clean' generation, who were much less into our vices compared those in the past. But more recently (maybe the past year or two) the tide seems to have turned. Drinking is on the rise amongst Zoomers, and while vaping has of course increased, smoking seems to have made a comeback too with top celebrities now taking it on. The shift is undeniable; I've seen a noticeable change irl as well as reading about it. Do you think is because we need something to drown our sorrows with? Or is it more to do with our nostalgia-based culture and we want to experience the old school party lifestyle? Should probably also note it seems to be mainly mid Gen Z driving this (late teens/early 20s), rather than the mid-late 20s.",https://www.reddit.com/gallery/1lvz5sa,287
GenZ,2025-07-10 00:14:35,Learning math in the new age,"Hello, GenX here. I earned my bachelor's degree in mathematics in 1988. We learned by writing notes and writing out the problems the professor taught during lectures. Then our homework included solving many difficult equations, by hand. How is college level mathematics taught now? Do you still solve the problems by writing them out? Do you just follow PowerPoint presentations and take online exams? Is everything done by computer now? For example, do engineers even need to take DiffyQ""s if a computer software program will do it for them?",https://www.reddit.com/r/GenZ/comments/1lvyp9p/learning_math_in_the_new_age/,0
GenZ,2025-07-09 23:36:28,Do you remember smoking in restaurants?,"Im talking early 2000s like 03 or 04 where you go to a restaurant and the hostess would asked if you wanted a smoking lounge or not?,",https://www.reddit.com/r/GenZ/comments/1lvxvht/do_you_remember_smoking_in_restaurants/,11
GenZ,2025-07-09 22:51:09,How do you feel about no tax on tips and overtime?,"It appears many GenZ work outside of the corporate structure, so more hourly type positions. How will not getting taxed on tips or working overtime impact your quality of life?",https://www.reddit.com/r/GenZ/comments/1lvwv7f/how_do_you_feel_about_no_tax_on_tips_and_overtime/,4
GenZ,2025-07-09 22:44:16,Is it normal to not care about your family?,"I don't give a fuck about my family. I live in close proximity to my uncle, aunt and my cousins, and I don't care about them. If my cousin were to die, I couldn't give less of a fuck. My 82-year-old aunt went to the hospital because she had a stroke. My family sent us it in a group chat, and all I could think was, ""Am I supposed to care? Fuck, why are you texting me this for"" I don't care. Is this normal?",https://www.reddit.com/r/GenZ/comments/1lvwpjk/is_it_normal_to_not_care_about_your_family/,0
GenZ,2025-07-09 22:10:26,Am I a millennial or gen z?,"I first joined this group today, because I wanted someone to answer this long awaited, rent free in my head question. If I was born on September 12th, 1995 , Am i considered one of the youngest millennials rn, or the oldest Gen Z?",https://i.redd.it/ggx3n2gy9xbf1.jpeg,49
GenZ,2025-07-09 19:09:26,Question genz,"Genz why do you guys tend to completely ghost anyone that is older then your gen? I see a lot of this on the lonely sub.. they cry about being lonely no connections etc and people go out of their way to offer solace. They attempt to give them what they say they are so desperately missing only to be completely ghosted. I mean seriously 20 to 39 is not that big of a gap. Its like you guys are stuck in dont talk to grown ups mpde but yall became adults when you hit 18.. every generation before yours has known to respect their elders, no matter if that is a 16 year difference or a 60 year difference. Can someone explain this to me",https://www.reddit.com/r/GenZ/comments/1lvre9q/question_genz/,0
GenZ,2025-07-09 18:50:06,We should do a Digital occupy Wall Street.,"Were all angry and we go out we protest we go home. Were all burnt out and dont have a lot of connection so we seek it through are phone and they like it that way bc they know they can sell us something for that dopamine hit. They dont feel the hurt because theyre still making money. They only care about the economyBUT WE ARE THE ECONOMY. During the target ~boycott~ their digital sales went up even though their stores had less consumers it works out for them. Amazon is successful because they turned retail store fronts into a logistics company They benefit more from the online shopping and can schedule less store employees. $$$$ for them. -Amazon controls 38% of US e-commerce. -Millions canceling Prime for even 1 month would show up in quarterly earnings. -Google, FACEBOOK, meta, instagram make millions in ad revenue. -These people are turning us into home shopping network and getting free employees free marketing all for the enticement of getting a following and being financially free. Gen Z makes up 40% of US consumers and 90% of TikTok users. If just 5 million people boycott Amazon for 1 month, they lose over $1 billion in revenue. If 10 million people stop watching YouTube for a week, Google ad revenue drops by tens of millions. We got the numbers. We dont even need to leave our houses. We can have the safety of decentralized movement. No single park. No leaders to arrest. No HQ to raid just us screwing them over. **If this post gets ANY comments or traction I will be surprised because its an all text post. **",https://www.reddit.com/r/GenZ/comments/1lvqwnt/we_should_do_a_digital_occupy_wall_street/,0
GenZ,2025-07-09 18:43:53,Gen Z & The End of the World - How Do We Stay Hopeful?,"Hey everyone! sorry in advance for the doomerism and generally dark/pessimistic tone, I promise I'm not trying to be overly sensationalist and dramatic, just genuinely struggling with the weight of everything lately. Im a Zoomer guy who is trying to stay hopeful, but sometimes I genuinely wonder how others manage to stay motivated and think positively about the future and do things like starting a family (esp. having kids, taking mortgages, etc...) when we seem to be inheriting a world that feels increasingly hostile to us, especially to the ones who aren't rich or isolated. From overwhelming wealth inequality that makes it seem like working won't really get you anything anymore, and the mental health crisis to the cost of living disaster, climate change, wars essentially on every continent, automation threatening any chance for us to be able to climb the career ladder without being ""someone's child"", and less-talked-about issues like the healthcare worker shortage (aka that many of us wouldn't even be able to get an affordable, quality doctor to treat us), ecosystem collapse, rising crime and addiction rates, and even the looming threat of antibiotics-resistant bacteria its a lot. Id love to hear how our fellow zoomers still manage to keep going, stay inspired, or make sense of all this nonsense and BS. doesnt it scare you too, knowing were the ones wholl have to deal with the fallout or the possible freaking end of the world? am I being overdramatic?",https://www.reddit.com/r/GenZ/comments/1lvqqr1/gen_z_the_end_of_the_world_how_do_we_stay_hopeful/,0
GenZ,2025-07-09 18:26:19,Posting this tier list I made a while back of years that I (22M) have live through,,https://i.redd.it/c4e0hi6z5wbf1.jpeg,0
GenZ,2025-07-09 17:50:48,Does gen Z drink less than past generations?,Went to a concert the other day that was young 20 somethings mostly. A lot of folk had liquid death instead of beer and everyone either had a vape or zyn.,https://www.reddit.com/r/GenZ/comments/1lvpdgn/does_gen_z_drink_less_than_past_generations/,12
GenZ,2025-07-09 17:45:04,Rate my recently played 1-10,,https://i.redd.it/ecttvz8myvbf1.jpeg,4
GenZ,2025-07-09 17:39:06,Stop asking what about when Obama did it? in a Gen Z sub.,"No one Gen Z could vote until 2016 at the EARLIEST. I myself am born in 95 (which most people dont consider Gen Z) and my first presidential election was 2016 Trump v Hillary. None of us have even had a presidential election without Trump on the ballot. Its a stupid comeback no matter who you say it to because people grow and their beliefs change, but for gods sake its the dumbest thing you could ever say to people who werent even old enough to vote in 2012.",https://www.reddit.com/r/GenZ/comments/1lvp2lz/stop_asking_what_about_when_obama_did_it_in_a_gen/,307
GenZ,2025-07-09 17:35:06,Girl I've been seeing keeps cancelling on me,"Hey, so there's this coworker(f30) I've(m22) been seeing. We've hung out 3 times. 1st time was us getting coffee then we randomly decided to get breakfast too, 2nd she invited me to tag along with our friend to go to a pride thing then a bar afterwards and we had a damn good time, then 3rd time we got ice cream and played tennis. On Monday we were planning on going to another Ice Cream place(I was actually planning on telling her how I fell that day) but at lunch she informed me she was feeling really tired and I told her I understood and I asked if we could reschedule to Wednesday, which she gave a ""If I'm feeling up to it then yes"" however today she just cancelled again over text, apologizing and asking if we can reschedule. Normally I would definitely just decide she doesn't want to hangout with me and move on however there are some factors that stop me. 1. I'm almost positive she's not lying about being tired, we work nightshift at a decently physically demanding job and she's works a fuck ton of overtime (the past 2 weeks she's worked 55+ hours each week) and I know how much nightshift can drain you even if you have normal hours. She mentioned how one day after getting home she slept almost 13 hours. 2. We have genuinely been having fun together I think, we're having good conversations and learning about each other. She also informed me (in a non-trauma dumpy way) of her traumatizing past and we talked about that and how she's recovered 3. She mentioned cancelling on another friend of hers because she was tired. Should I just give her space for a week or 2 then start trying to hang out again or does she probably just not sound interested? I genuinely am not upset with her if she's being honest about being tired but I also don't want to be pulled along.",https://www.reddit.com/r/GenZ/comments/1lvoysv/girl_ive_been_seeing_keeps_cancelling_on_me/,0
GenZ,2025-07-09 17:18:49,"2007-09 kids, do you think your more gen z or gen alpha?","People on other subs keep telling me (09) that Im more gen alpha because I grew up with gen alpha and that I had an iPad. Thats all true, but my first iPad was used for watching downloaded shows on iTunes. Gen alpha grew up using their iPads for Roblox, YouTube, and streaming services. I feel like Im Gen z, and I dont wanna be Gen alpha. What do you guys think?",https://www.reddit.com/r/GenZ/comments/1lvojhl/200709_kids_do_you_think_your_more_gen_z_or_gen/,1
GenZ,2025-07-09 16:27:24,This map shows the different regions and what they call soft drinks.,"Where the black dot is on the 2023 map is where I live. According to this map, where I live says soda. Thats not trueIve never once heard a person here say soda. Its pop. And why is pop the correct term? Have you ever put a can of pop in the freezer until it exploded? Thats why its called pop.",https://i.redd.it/0o44tmbrkvbf1.jpeg,2036
GenZ,2025-07-09 15:57:56,people need to understand nuance,"Nuance is taking time to listen and come out with an opinion. It doesn't mean being neutral you could still have strong opinions, Like you could think America should've stayed out of Vietnam do research and find out what they did to the civilians and they also bombed South Vietnam and have a stronger opinion of yeah they should've definitely stayed out. Being nuance doesn't mean pussyfooting around with ideas like the whole well you got to listen to both sides yeah I have listened but some opinions are just horrendous and dont deserve the time of day to listen to. Your ignorance is not equal to knowledge its not always just a difference in opinion sometimes people are just straight wrong and sometimes that person could be you. Not everything has a middle ground to find in not saying there is no gray area but you got to understand when to have an opinion and when to shut up and listen.",https://www.reddit.com/r/GenZ/comments/1lvmgvq/people_need_to_understand_nuance/,13
GenZ,2025-07-09 15:18:50,To the older gen Zs. How different would your life had been if the pandemic never happened?,,https://www.reddit.com/r/GenZ/comments/1lvlh1t/to_the_older_gen_zs_how_different_would_your_life/,15
GenZ,2025-07-09 15:16:14,Give me all your memes(preferably reaction memes).,,https://i.redd.it/z81fisw18vbf1.jpeg,1
GenZ,2025-07-09 14:32:42,Whats your favorite emoji right now and why?,No wrong answers people. Whats your favorite emoji rn and (optionally) why dont I fully appreciate it? Enlighten me!,https://www.reddit.com/r/GenZ/comments/1lvkbcr/whats_your_favorite_emoji_right_now_and_why/,0
GenZ,2025-07-09 14:11:08,"People who have 800-1000 followers on instagram, do u know every single one or majority of those ppl??",I feel like ppl with those followers counts usually just follow random mutuals,https://www.reddit.com/r/GenZ/comments/1lvjskm/people_who_have_8001000_followers_on_instagram_do/,3
GenZ,2025-07-09 13:55:17,21-25 is a weird age,"That's when people start getting into carriers or jobs, move out, die or go to prison, one of my bullies in highschool died in a strip club parking lot in Atlanta, from word of mouth I they was arguing about who disrespected who and he got shot , one of my other classmates from highschool is serving life while stayed out of drama and work a bullshit 25 a hour job trying to get my own place with room mates. I know guys who got 4 and 5 baby mamas none of the homies are married, not to sound ignorant but I always looked at marriage as a white people thing I don't know anybody in my race my age married, baby mamas and baby daddies was just normal.",https://www.reddit.com/r/GenZ/comments/1lvjeyz/2125_is_a_weird_age/,805
GenZ,2025-07-09 13:22:31,Is vanity far less than a sin now?,"I don't mean like a religious sin, but more like a fault. Idk what the cutoff for gen z is but I was born in '95. Growing up I felt as if there were more niche things, people in their own circles whether they were punks, jocks, nerds or whatever. However all these groups actually had something in common which was that they found superficial and materialistic things quite lame. I remember girls and female celebrities being tired of reality tv stars, and there was growing concern about what social media would do (which... wow the old people finally got one right!). Sure some of that hate could be jealousy, but I don't think it was the foundation for criticizing desperate fame. But that desperate fame seems more charming to people now. Like if that's what they have to do to get that bag, go for it. Most art depicted the folly of greed as well. Apart from political condemnation of billionaires, praise of wealth and materialism seem higher than ever. And in fact criticism of that very much makes you the party pooper. It feels like the rich kids at school won, everyone wants to be Regina George not Cady. Most things are treated the way women use Halloween costumes, IT HAS TO BE SEXY. If something is goth it has to be sexy goth. Sexy nerd. Sexy poet. Sexy entrepreneur. Sexy painting. Sexy dancing. Sexy sex. I can't really think of who could be the Bill Hicks or George Carlin for gen z, the types who took a sledgehammer to the commercial culture of America. Maybe Bo Burnham, but he was quite ineffective and tame. I don't think we have to be mean to current icons but I do think we need some counterweight here. I also used to think Americans were uniquely superficial, until I got into kpop and learned a little more about the current culture for young people there lol. Mexico is changing closer to us too, to my surprise Japan also seems more superficial given that these types of conversations don't tend to happen at all there. I have maybe a too optimistic view of Nordic countries, but that gets me to wondering if any gen z people here have maybe a whole different perspective being from different countries.",https://www.reddit.com/r/GenZ/comments/1lvio81/is_vanity_far_less_than_a_sin_now/,2
GenZ,2025-07-09 13:14:35,The Duality of Man,,https://i.redd.it/dp5m5owcmubf1.jpeg,17
GenZ,2025-07-09 12:52:44,Whats everyone sitting around waiting for?,,https://www.reddit.com/r/GenZ/comments/1lvi0bn/whats_everyone_sitting_around_waiting_for/,8
GenZ,2025-07-09 12:01:15,How is being Born as a gen Z in america?,I'm a european gen Z and i was wondering how Is the gen Z experience in america. Tell me!,https://www.reddit.com/r/GenZ/comments/1lvgylx/how_is_being_born_as_a_gen_z_in_america/,22
GenZ,2025-07-09 11:58:35,"I remember someone here posted asking when and how did non-Trump politicians ever operated against white men. Well, here's an example: starting today, the DHS of Minnesota will force hiring managers to hire minorities over white people, needing a good justification for not doing so, or be fired",,https://www.reddit.com/gallery/1lvgwnp,0
GenZ,2025-07-09 07:55:06,What the fuck does means?,,https://www.reddit.com/r/GenZ/comments/1lvczy3/what_the_fuck_does_means/,458
GenZ,2025-07-09 06:48:40,Do any of us watch talk shows?,"Are talk shows still watched by anyone whos Gen Z, because I dont really know anyone whos my age and watching Jimmy Fallon or anyone else unless its a small clip of something iconic happening",https://i.redd.it/hzl90mcipsbf1.jpeg,60
GenZ,2025-07-09 06:38:01,Whats your favourite kids show growing up? Ill start,,https://www.reddit.com/gallery/1lvbupo,30
