subreddit,date,title,content,url,score
GenZ,2025-07-06 02:41:21,Why is this generation so antisocial?,"I'm a college student, and it seems like no one wants to interact with each other. In some classes it's dead silent from the start to finish without a single conversation between students before or after class. What happened to the humanity in this generation? Have we forgotten human connection is what life is all about?",https://www.reddit.com/r/GenZ/comments/1lsqqm2/why_is_this_generation_so_antisocial/,489
GenZ,2025-07-05 23:47:13,For the Cinephilles in this sub:,,https://i.redd.it/0esn4x0k75bf1.jpeg,308
GenZ,2025-07-05 22:24:07,Top 5 best countries in the world today imo,1) China 2) Japan 3) UAE 4) Singapore 5) Qatar,https://www.reddit.com/r/GenZ/comments/1lslsx0/top_5_best_countries_in_the_world_today_imo/,0
GenZ,2025-07-05 21:49:52,2032 is when kids born in 2014 graduate,,https://i.redd.it/yzd6jq7nm4bf1.jpeg,920
GenZ,2025-07-05 21:06:52,Oh my God guys the villain was being... Villainous.,,https://i.redd.it/r6dcatrye4bf1.png,401
GenZ,2025-07-05 20:59:24,Are you into film?,"I'm 21 and into filmnot just as something to watch for entertainment, but as an art form. I study film history, the movie industry as a whole, etc. Most people just watch movies for fun and dont really care about film as an art. I love classic movies, especially films from the 1940s to the 1960s. My favorite comedy is *Some Like It Hot*. I recently saw *Jurassic World: Rebirth*, and I didn't like it at all. My theater was full of Gen Z kids, millennials, and parents with little kids. And after the movie ended, they all clapped. This movie was awful. Sure, the CGI was good, three action scenes were solid, and the cinematography was amazingbut outside of that, it was bad. The characters were dull and one-note. You dont care about any of them. You might only like Zora and Duncan, but thats just because they're played by Scarlett Johansson and Mahershala Ali. The plot? A CEO hires a team of mercenaries and a paleontologist to go to an island and collect samples from dinosaurs to cure diseases. Simple video game logicfine, whatever. But then they randomly introduce this annoying family who has no reason to be in the movie. The daughters boyfriends are all insufferable, and whats worse is if the characters didnt literally tell you one guy was her boyfriend, you wouldnt even know. They barely talk. They dont kiss. They dont have any one-on-one scenes. Hes just there. And people *actually* like this movie? Forget compelling, rich characters. Forget strong plotting. Casual audiences just want to be distracted. Thats what gets to me. Because I saw *The Brutalist* last year, and I was the only one in the auditorium. No one came to see this well-crafted film with stunning visuals, cinematography, and *great* acting. But everyone packed out the theater for the new *Jurassic World* moviea film doing nothing new, a franchise that shouldve ended after *Jurassic Park III*. So I want to askpeople who are my age or a little older, like 21 to 25do you *actually* like this corporate slop? Did you skip *The Brutalist*? *Killers of the Flower Moon*? *Oppenheimer*? *Anora*? *Pieces of a Woman*? Do you care about film as an art form? Do you even watch classic films from the '50s and '60s? Are you into film? Like actually into film or do you just watch movies to be entertained? Do you know who Dana Andrews, Victor Mature, and Glenn Ford are?",https://www.reddit.com/r/GenZ/comments/1lsjyso/are_you_into_film/,11
GenZ,2025-07-05 20:16:30,Any Gen Z teachers here? How's it going so far?,,https://www.reddit.com/r/GenZ/comments/1lsj0ka/any_gen_z_teachers_here_hows_it_going_so_far/,4
GenZ,2025-07-05 19:43:56,Stop Complaining about how Toxic the Internet Is. Be the Change you Wish to See in the World.,"Go ahead and tell me how ""cringe"" this interaction is, how this only applies under XYZ circumstances, how you've tried to be nice but never see it returned. It won't change the fact that being kind for kindness's sake is the way to go. Always.",https://www.reddit.com/gallery/1lsiajz,8
GenZ,2025-07-05 18:52:07,Bowling,Do you like it? Do you play it? Is it outdated?,https://www.reddit.com/r/GenZ/comments/1lsh4j0/bowling/,2
GenZ,2025-07-05 18:47:05,my lifespan is actively lowering under this administration and i'm literally one of y'all,"yeah i'm not asking for input this is a vent based on facts that i know, with a focus on the reality of poverty as the seasons pass, and financial oppression consumes the working class (i.e. the wage slavery to pay $3000/mo just for a bare residence, which you might notice is exponentially larger than Americans' real disposable wage) the typical person. no severe health concerns. no college degree (and none of that ""i finished halfway and gave up"" shit. i couldn't even afford that), like i have taken four entry level classes and done Coursera certificates at budget rates), no health insurance that i have to pay for or my own yet, and i am unable to afford an apartment or car while living in a car dependent area with a dead job market (so fr it's retirees taking money for themselves while starving their employees). moreover in the typical, i've worked in the food service industry in the community in entry level, so i have seen this first hand. financial hardship encroached on my ability to get to interviews, facing denials in the beginning stages of jobs I might otherwise receive after the interview, would I have been able to get there. i wasn't able to afford to eat or get to any interview with taking a financial toll for the MONTH. being alive is no longer sustainable, and i tried to adjust by looking for remote work but then all we need to do is now monetize every second, yeah right. work gave me insurvivable insomnia and depression. work and the rat race of staying alive can't work when it takes 1 person 5.5 jobs to be able to stay alive for one month. this is an extreme example, as it's physically impossible. that person in most cases would have no home or food. the systematic priceout of gen z and lower working classes is already evident. i see homeless and struggling peers on tiktok and i fear that the ones i don't see have fallen victim to each winter that passes and each heat wave that i can't bare. the news isn't breaking. it's that no matter how hard we strive to pay the toll of toxic environmental poisons and work culture, the air is heating up outside. an electric bill is what might be left of your life if an environmental DISASTER hits, as other important tools and fields are defunded and neglected. none of that will matter, but humanity still has it's years to count the bodies it's stolen and maimed. i'm gonna boil water for ramen. i'm 21. can anyone else describe how their encroaching homelessness felt?",https://www.reddit.com/r/GenZ/comments/1lsh0dx/my_lifespan_is_actively_lowering_under_this/,66
GenZ,2025-07-05 17:33:49,Started my job life and it is so boring!,"Life has become so monotonous, and nothing of interest remains. How to add fun?",https://www.reddit.com/r/GenZ/comments/1lsfc0s/started_my_job_life_and_it_is_so_boring/,61
GenZ,2025-07-05 17:27:08,"Going on a roadtrip in a few hours, send me some music recommendations for the road!","Ill listen to anything tbh, but im more of a rap, r&b, pop, indie fan but im also barely getting into kpop/jpop",https://www.reddit.com/r/GenZ/comments/1lsf6oy/going_on_a_roadtrip_in_a_few_hours_send_me_some/,1
GenZ,2025-07-05 16:17:41,(Question for the Americans in this sub) what does GenZ think the American dream is?,"I keep hearing people my age making statements along the lines of the American dream is dead and so on. But at the same time I hear the same people acting like if they dont have two cars and a McMansion in the suburbs that theyre somehow failing. That was never it, it was always the promise that upward mobility is possible and even if we dont make it ourselves that our kids might have a shot. Contrast that with a country like India for example with a caste system that hinders upward growth.The American dream was never the white picket fence with 2.5 kids and a dog",https://www.reddit.com/r/GenZ/comments/1lsdl6a/question_for_the_americans_in_this_sub_what_does/,26
GenZ,2025-07-05 15:43:51,Are millennials the lamest generation ever?,Ok i know the title would offend alot of millennials but here me out last night i was in the beach with my friends training (running and doing calisthenics) and this woman showed up she looked to be between 30-35 years old and she started screaming at us saying we was disturbing the people mind you no one complained but her and she also threatened to call the cops causing a scene. Why are they always like this?,https://www.reddit.com/r/GenZ/comments/1lsct8z/are_millennials_the_lamest_generation_ever/,0
GenZ,2025-07-05 15:35:57,"[OC] Happy MLG revival day! As a huge Titanfall and MLG fan, I remade one of my old posters! I still remember these hilarious montages from my childhood.",,https://i.redd.it/7td4dyjnr2bf1.png,3
GenZ,2025-07-05 14:37:35,i dont smoke weed or vape and im starting to get self-conscious ab that,"like everyone i meet does it - i dont judge anybody for doing itit just makes me feel left out sometimes damn idk why, but i am not interested in it feeling like the weird one and a good girl is just awful i just want to fit in so bad :(",https://www.reddit.com/r/GenZ/comments/1lsbcdo/i_dont_smoke_weed_or_vape_and_im_starting_to_get/,1
GenZ,2025-07-05 14:04:35,"Why does Gen Z do _____, yall there is no unified Gen Z","There is no pop culture anymore, just microniches. There are popular things but the consistent thing about this generation is the lack of consistency. Well except maybe the terrible job market. Its most frustrating when theres a thing with a fan base made up primarily of Gen Z but that doesnt mean that the generation as a whole is a fan. Like most furries are Gen Z but most Gen Z arent furries. Its particularly frustrating with politics. Like no [Gen Z men are not particularly right wing](https://www.pewresearch.org/politics/2024/04/09/age-generational-cohorts-and-party-identification/) just less liberal than millennials at this time. No most men arent incels, crazy, a part of some specific group or overwhelmingly have some unique opinion.",https://www.reddit.com/r/GenZ/comments/1lsamru/why_does_gen_z_do_yall_there_is_no_unified_gen_z/,136
GenZ,2025-07-05 13:28:59,Some people don't like their little bubbles being popped,"Literally was just trying to look deeper and maybe get people to see that these ""fascists"" we talk so much about are a lot closer than you think (they are) and see that the only difference between them is public opinion, power, and numbers. I'm aware that I prolly sounded like an ass at points but for conversations like these it demands complete lack of arbitrary emotions and true objective thought imo",https://www.reddit.com/gallery/1ls9wvw,0
GenZ,2025-07-05 13:12:19,I will never be able to afford children.,"I was recently on the phone with my grandmother. We talked for a bit before she asked again if I would be having children soon, since I'm 25 and she had my mother a few years younger. I paused for a moment, knowing it was coming from a place of love and her desire to see me start family of my own. I gently told her that simply wasn't possible with everything going on. Children are too expensive for me right now, I jokey said: ""Ask me again, when I'm 35!"" She says she'll be dead by then. We both laugh for bit before moving on to something else. But the conversation did stick with me. I make around $48,000 a year and I can't feed a kid on that. Shower thoughts.",https://www.reddit.com/r/GenZ/comments/1ls9kyr/i_will_never_be_able_to_afford_children/,1113
GenZ,2025-07-05 11:47:55,Happy 4th Every1!,Wishing y'all the best!,https://www.reddit.com/r/GenZ/comments/1ls81pt/happy_4th_every1/,0
GenZ,2025-07-05 11:25:21,This part still hits hard after nearly a decade,,https://v.redd.it/nvdafj55j1bf1,15
GenZ,2025-07-05 07:39:25,"My parents have a negative opinion of me, they think I'm a stupid loser","It's clear to me that my parents have a negative opinion of me ever since highschool. I remember one time I went to hangout with some friends and my father said ""use this to practice your social skills""??? As if I never hung out with people before and am a loser. Another time when he introduced me to his friends from work, earlier that day i had a meeting with a counselor for school and my parents attended. My father then said when talking to his friends from work to have a conversation like I just did in school, he literally thinks I have no other conversational experience. Now that I am in college and live by myself for a large part of the year they literally expect me to be on my phone 24/7 or something. When my mother calls or texts me and I'm unavailable at that moment she always says shit that I honestly find to be mean spirited. She says why aren't you responding u just spend all day in your room and on your phone doing nothing all day. She never assumes that I'm outside hanging out with friends even tho that's sometimes the case or anything like that because they think I'm a loser. She also seems to have no faith in me when I want to do something. When I say i go to the gym regularly now she says I'm lying. When I say i want to try and start cooking for myself she sarcastically says sure you will. My father also says I spend all day playing video games which isn't even true, even when I live with them, I was never as big as a gamer as my brother which I think is why they say this about me. There's also the thinking I'm stupid part which I think people from the outside will understand. I've failed classes and because they pay for my college I understand why they are mad at me. However, they have never had faith in me since the start. I do a stem degree and ever since I applied they wanted me to change because they think I'm stupid. Even when it started they asked me every time we called without fail do you want to change you should change its too hard for you. Before I ever failed a class. It makes me sad knowing they think im a stupid loser",https://www.reddit.com/r/GenZ/comments/1ls4ejj/my_parents_have_a_negative_opinion_of_me_they/,29
GenZ,2025-07-05 06:19:09,What do yall think about friends before dating?,"I feel like Im cooked here. Im 21m and Ive never had a girlfriend, and I still feel so lost on how dating works. I was having a (drunk) discussion with my friends tonight about a girl I was talking to that Im pretty sure was just talking to me in a friendly manner, and then that turned into a convo about whether guys and girls can be friends, and then I was wondering if our generation believes in friends before dating. And see, my problem is that I need to be able to have a somewhat established connection with someone to actually want to date them. Like there are a couple of friends I have/had, that are attractive, but I dont feel compatible with and so I wouldnt date. I even realized last year with one girl, that after liking her when she wasnt available, it was only because I thought she was attractive and because I was just getting desperate. In actuality, we were better off as friends even if she would have liked me back. So I want to make sure I dont fall for a girl Im infatuated with. However, I always hear that a bad thing guys do is hide his intentions or like a friend. And I know everyone is different and situations vary, but its still confusing. I feel like Im lost on how to approach things. Like am I wrong to want to have a deeper understanding of someone before committing to them? Maybe its just the negative of only really caring about the long term?",https://www.reddit.com/r/GenZ/comments/1ls3719/what_do_yall_think_about_friends_before_dating/,24
GenZ,2025-07-05 05:59:40,Water Tester?,Water testers are they real or fake? LOL this is a joke!!,https://v.redd.it/qbzxs184xzaf1,0
GenZ,2025-07-05 05:26:55,4th of July don't hit the same anymore,"Honestly with everything going on in the country, the new bill that just de-funded medicaid and the constant attacks against minorities especially with the ICE raids I don't really feel like celebrating 4th of July. Edit: no I wasn't on the computer all day, I was actually out with my family still didn't hit the same",https://www.reddit.com/r/GenZ/comments/1ls2e18/4th_of_july_dont_hit_the_same_anymore/,320
GenZ,2025-07-05 03:50:09,Are most Gen Z unemployed?,Can't imagine you all have a job and I don't.,https://www.reddit.com/r/GenZ/comments/1ls0u82/are_most_gen_z_unemployed/,254
GenZ,2025-07-05 03:15:14,Got to a new job yesterday,"And when I was talking to a older coworker and he asked me what I do during my day offs and I said that I usually play video games or just go to a mall and he asked me that ""do you play Roblox?"" And I said no and I asked why and he said to me ""ain't yah youngins play that?"" And I said to him that I'm too old to play that game anymore and he asked me how old am I and I told him that I'm 27 and he was confused because he thought I was still 20",https://www.reddit.com/r/GenZ/comments/1ls09ou/got_to_a_new_job_yesterday/,6
GenZ,2025-07-05 03:02:35,do people not understand what eat the rich means,People act like eat the rich means poor people who are jealous of someone with a Ferrari and is well off. No eat the rich means that we have more common with that person than we will have with the top 1% so we should stand in solidarity because that 1% has about 47% of the wealth that keep in mind we all worked for. So why should these people sit on top of society when we are the back bone of society we could spread out that wealth and make a better society. And dont go on how billionaires make all their money fairly so they deserve to keep it.,https://www.reddit.com/r/GenZ/comments/1ls02bq/do_people_not_understand_what_eat_the_rich_means/,124
GenZ,2025-07-05 02:59:41,Do people look younger today than 30 years ago?,"I have seen a lot of people and research studies claim that people look younger than her than they actually do these days. Although, I have seen people in general z who look older than they actually are. Like I have seen a lot of people who are balding in their early 20s. What do you guys think?",https://www.reddit.com/r/GenZ/comments/1ls00ds/do_people_look_younger_today_than_30_years_ago/,18
GenZ,2025-07-05 02:10:26,Is this house the equivalent of the breaking bad house for Squid Game fans,,https://i.redd.it/z5qxgdw1syaf1.png,14
GenZ,2025-07-05 02:09:23,How do you feel about the new Big Beautiful Bill?,[View Poll](https://www.reddit.com/poll/1lrz6d9),https://www.reddit.com/r/GenZ/comments/1lrz6d9/how_do_you_feel_about_the_new_big_beautiful_bill/,5
GenZ,2025-07-05 00:21:09,perpetual license was so much better with adobe,Yes I understand the adobe creative suite was $2500 but you were able to keep the software for good.,https://i.redd.it/bo58pe3q8yaf1.jpeg,141
GenZ,2025-07-04 22:26:03,So Big Beautiful Bill just passed.,How is everyone doing Are we going to show up in 2028 or nah?,https://www.reddit.com/r/GenZ/comments/1lrv2qi/so_big_beautiful_bill_just_passed/,61
GenZ,2025-07-04 21:45:51,bro holy shit does anyone else barely remember this movie?,,https://i.redd.it/cu3uref0hxaf1.jpeg,576
GenZ,2025-07-04 20:19:35,I recommend living in the present instead of ruminating in the past or dreading the future.,,https://i.redd.it/amdv8nkm1xaf1.jpeg,117
GenZ,2025-07-04 19:44:19,Why is Joe Rogan popular among Gen Z?,"On my recent trip to Tennesse, my brothers and cousin put on Joe Rogan halfway through our destination. I listened to a bit of it, and then I eventually put on my earbuds and listening to my own music. I'll admit I don't listen/watch podcasts besides one based on animation news but even then, I never listen/watch them in full and only get to the parts I'm interested. But in the case of Joe Rogan, I just don't get it. I heard he's supposedly a 'centrist', yet he talked about conspiracy theories and right-wing politics from what I remember. Hell, the episode they put on was one interviewing Donald Trump. One thing noticed is a lot of Gen Z, particular those who were more right leaning listening to him. On the way back, I knew they were going to put Joe Rogan on and I thankfully had my laptop on me and put on a movie for myself. What do you guys think?",https://www.reddit.com/r/GenZ/comments/1lrrliu/why_is_joe_rogan_popular_among_gen_z/,132
GenZ,2025-07-04 19:23:29,What comedy films does Gen Z like? Are there a few comedy movies gen Z likes to quote a lot?,,https://www.reddit.com/r/GenZ/comments/1lrr4mh/what_comedy_films_does_gen_z_like_are_there_a_few/,6
GenZ,2025-07-04 19:03:03,Have you seen the Zillennials article from Wikipedia?,,https://www.reddit.com/gallery/1lrqnuw,11
GenZ,2025-07-04 18:56:24,Happy Independence Day!,"Despite everything, today is the day we celebrate our identity and celebrate the values of who we are as citizens underneath everything the government does. Enjoy today folks!",https://www.reddit.com/r/GenZ/comments/1lrqi42/happy_independence_day/,8
GenZ,2025-07-04 18:13:25,What is the best Halo game?,"A lot of us grew up with these games, what are your thoughts?",https://i.redd.it/whfz0xw1fwaf1.jpeg,90
GenZ,2025-07-04 17:12:44,Sooo BBB passed...,Did anything happen? Is something going on in USA today?,https://i.redd.it/viprkbk64waf1.png,751
GenZ,2025-07-04 16:22:27,Kindergarten 3,"Have any of you guys seen YouTubers play this game called Kindergarten 3? I remember watching CaptianSauce play the pervious two games and Im so glad hes well enough to post Kindergarten 3 content. It doesnt have to be YouTubers in general, but if youre familiar with the Kindergarten game series, then what are some things you like about it?",https://www.reddit.com/r/GenZ/comments/1lrmtxl/kindergarten_3/,0
GenZ,2025-07-04 15:51:52,What is something nostalgic,I used to have this exact one but lost it instantly I found it a year ago,https://i.redd.it/cxrh1zzupvaf1.jpeg,50
GenZ,2025-07-04 15:19:08,Just saw this graph this morning on entry level unemployment. Thoughts?,"The recent college graduates unemployment rate is quickly catching up to high school unemployment the past 3 years, largely due to the elimination of entry level jobs. So whats recent grads to do to get a job?",https://i.redd.it/m9y0j6q0kvaf1.jpeg,112
GenZ,2025-07-04 13:22:22,Can we stop taking our anger out on each other?,"Most of us are literally just trying to survive late-stage capitalism without losing our minds. Meanwhile, the 1% are chilling in their penthouses, sipping wine and watching us tear each other apart over crumbs like its reality TV. The real enemy isnt your neighbor or that random person online, its the 1% hoarding the wealth and power, laughing while we fight over scraps. Lets not give them the satisfaction.",https://www.reddit.com/r/GenZ/comments/1lrimn2/can_we_stop_taking_our_anger_out_on_each_other/,29
GenZ,2025-07-04 11:47:14,Why can't Gen Z circuit train in the gym?,Why must you sit at a machine on your phone during recovery of 45 minutes. You can workout a different muscle group while the previous one is recovering. It actually makes working out faster and leads to less boredom. It also is considerate of people who need to use the machine you are using. This is especially annoying with the younger gen z broccoli heads.,https://www.reddit.com/r/GenZ/comments/1lrgrdc/why_cant_gen_z_circuit_train_in_the_gym/,0
GenZ,2025-07-04 11:15:36,What do yall do on a Friday / Saturday around 6pm? I've always worked at night during these times so what do yall do usually?,,https://www.reddit.com/r/GenZ/comments/1lrg7rq/what_do_yall_do_on_a_friday_saturday_around_6pm/,1
GenZ,2025-07-04 11:07:21,anyone else with a deep voice feeling kinda self-conscious about singing?,"Hey Gen Z, Ive always had a deep voice for a girl, and I love singing, but sometimes I feel super shy about it. Like, I wanna sing loud and proud but end up holding back because Im worried people wont vibe with it. Is anyone else dealing with this? How do you get past those vibes and just enjoy doing you? Would love some real talk or advice! Thanks",https://v.redd.it/v7lj096zauaf1,6
GenZ,2025-07-04 08:38:50,Is anyonelse just tired of politics?,"Everyday I wake up or go through the day just to be brought into some crazy news. Its tiring and Im to the point I just wanna be able to go back to when I was a little kid, and politics or world news didnt matter. Or at least didnt to me. Im torn between wanting to be informed and just living in the term that ignorance is bliss. I live in a rural area and genuinely dont think the people around me are bad people, but I think they are very badly misinformed and I could spend hours upon hours trying to change peoples minds, but Id most likely not be successful and would be even more tired. Is anyonelse just tired?",https://www.reddit.com/r/GenZ/comments/1lrdr6y/is_anyonelse_just_tired_of_politics/,68
GenZ,2025-07-04 08:02:07,"Gen Z, what are your favourite story/singplayer games to come out in the past 15 years? (2010-2025)","Just curious to see others opinions. My top 3 have to be Nier automata, Batman Arkham City and Sekiro but there are definitely a lot more contenders.",https://www.reddit.com/gallery/1lrd7p6,14
GenZ,2025-07-04 07:20:32,Gen z in a photo,,https://i.redd.it/e72y21tm6taf1.jpeg,0
GenZ,2025-07-04 05:52:46,What kind of timeline is this,https://preview.redd.it/qvs6s37pqsaf1.png?width=1080&format=png&auto=webp&s=ae87a4cf57d62bcd5458176f012285e9d81af5ec,https://www.reddit.com/r/GenZ/comments/1lrb7jg/what_kind_of_timeline_is_this/,7
GenZ,2025-07-04 05:48:38,Hot Take: We shouldnt hate on people because of immutable characteristics.,Controversial take I know,https://www.reddit.com/r/GenZ/comments/1lrb541/hot_take_we_shouldnt_hate_on_people_because_of/,44
